{
  "self_uav_id": 1,
  "master_id": 1,
  "num_uavs": 3,
  "broker_ip": "127.0.0.1",
  "broker_port": 3400,
  "telemetry_topic": "telemetry",
  "external_messages_topic": "external/messages",
  "suggestions_topic": "uav/suggestions",
  "ground_formation": "Circle",
  "flying_formation": "Linear",
  "ground_min_distance": 10.0,
  "flying_min_distance": 50.0,
  "takeoff_strategy": "Hungarian",
  "takeoff_is_sequential": false,
  "altitude": 10.0
}
